{
  "arc_shift": null,
  "band": "Building",
  "categories": {
    "backswing_top": {
      "category": "backswing_top",
      "checks": [
        {
          "abs_value": false,
          "advice": null,
          "band": {
            "falloff": 20,
            "max": 180,
            "min": 150
          },
          "category": "backswing_top",
          "checkpoint": "P4",
          "deferred": false,
          "effort": 3,
          "field": "lead_arm_angle",
          "fix": "Width drills \u2014 comfortably extended, not locked.",
          "good_values": null,
          "id": "BKS-01",
          "kind": "band",
          "label": "Lead arm structure at top (relatively straight)",
          "leverage": 38.3,
          "leverage_breakdown": {
            "ease": 60,
            "impact": 55.0,
            "severity": 0.0
          },
          "score": 100.0,
          "skip_reason": null,
          "unit": "deg",
          "value": 151.9,
          "weight": 55
        },
        {
          "abs_value": false,
          "advice": "Fold your trail elbow more at the top \u2014 it's staying too straight and away from your body (a 'flying elbow').",
          "band": {
            "falloff": 20,
            "max": 105,
            "min": 75
          },
          "category": "backswing_top",
          "checkpoint": "P4",
          "deferred": false,
          "effort": 3,
          "field": "trail_elbow_flex",
          "fix": "Elbow-down feel.",
          "good_values": null,
          "id": "TOP-02",
          "kind": "band",
          "label": "Trail elbow flex at top (~90 deg, in front of the body)",
          "leverage": 71.7,
          "leverage_breakdown": {
            "ease": 60,
            "impact": 55.0,
            "severity": 100.0
          },
          "score": 0.0,
          "skip_reason": null,
          "unit": "deg",
          "value": 127.8,
          "weight": 55
        },
        {
          "abs_value": false,
          "advice": "Set your wrists more in the backswing \u2014 you're not hinging enough by the top, which costs stored power.",
          "band": {
            "falloff": 25,
            "max": 105,
            "min": 75
          },
          "category": "backswing_top",
          "checkpoint": "P4",
          "deferred": false,
          "effort": 3,
          "field": "lead_wrist_hinge",
          "fix": "Hinge drills.",
          "good_values": null,
          "id": "WRS-01",
          "kind": "band",
          "label": "Wrist hinge / set (radial) at top",
          "leverage": 72.7,
          "leverage_breakdown": {
            "ease": 60,
            "impact": 58.0,
            "severity": 100.0
          },
          "score": 0.0,
          "skip_reason": null,
          "unit": "deg",
          "value": 29.1,
          "weight": 58
        },
        {
          "abs_value": false,
          "advice": null,
          "band": {
            "falloff": 20,
            "max": 195,
            "min": 165
          },
          "category": "backswing_top",
          "checkpoint": "P4",
          "deferred": false,
          "effort": 4,
          "field": "lead_wrist_deviation",
          "fix": "Flatten/bow the lead wrist; HackMotion-style feedback. Sign of bow-vs-cup not yet verified against a fixture (checkangles.py) \u2014 band is symmetric around straight until confirmed; see COVERAGE.md.",
          "good_values": null,
          "id": "TOP-01",
          "kind": "band",
          "label": "Lead wrist condition at top (flat to slightly bowed)",
          "leverage": 39.3,
          "leverage_breakdown": {
            "ease": 40,
            "impact": 78.0,
            "severity": 0.0
          },
          "score": 100.0,
          "skip_reason": null,
          "unit": "deg",
          "value": 177.4,
          "weight": 78
        },
        {
          "abs_value": false,
          "advice": null,
          "band": {
            "falloff": 25,
            "max": 105,
            "min": 75
          },
          "category": "backswing_top",
          "checkpoint": "P4",
          "deferred": true,
          "effort": 3,
          "field": "shoulder_turn_from_address",
          "fix": "Thoracic mobility, full shoulder turn.",
          "good_values": null,
          "id": "ROT-03",
          "kind": "band",
          "label": "Shoulder turn at top (~90 deg)",
          "leverage": null,
          "leverage_breakdown": null,
          "score": null,
          "skip_reason": "shoulder/hip turn is derived from a 2D projected width (arccos of shoulder width over this clip's widest), which is sign-unstable through square and under-reads true turn by roughly half \u2014 it cannot be scored against criteria.md's anatomical degree bands. Needs a real turn estimate first; see scoring_config/COVERAGE.md.",
          "unit": "deg (2D-projected estimate)",
          "value": null,
          "weight": 68
        },
        {
          "abs_value": false,
          "advice": null,
          "band": {
            "falloff": 20,
            "max": 55,
            "min": 35
          },
          "category": "backswing_top",
          "checkpoint": "P4",
          "deferred": true,
          "effort": 3,
          "field": "hip_turn_from_address",
          "fix": "Trail-leg stability; don't over-turn the hips.",
          "good_values": null,
          "id": "ROT-04",
          "kind": "band",
          "label": "Hip turn at top (~45 deg)",
          "leverage": null,
          "leverage_breakdown": null,
          "score": null,
          "skip_reason": "shoulder/hip turn is derived from a 2D projected width (arccos of shoulder width over this clip's widest), which is sign-unstable through square and under-reads true turn by roughly half \u2014 it cannot be scored against criteria.md's anatomical degree bands. Needs a real turn estimate first; see scoring_config/COVERAGE.md.",
          "unit": "deg (2D-projected estimate)",
          "value": null,
          "weight": 62
        },
        {
          "abs_value": false,
          "advice": null,
          "band": {
            "falloff": 20,
            "max": 55,
            "min": 30
          },
          "category": "backswing_top",
          "checkpoint": "P4",
          "deferred": true,
          "effort": 4,
          "field": "xfactor_rotation_est",
          "fix": "Resist the hips, full shoulder turn.",
          "good_values": null,
          "id": "ROT-01",
          "kind": "band",
          "label": "X-Factor at top (~40-45 deg shoulder-hip separation)",
          "leverage": null,
          "leverage_breakdown": null,
          "score": null,
          "skip_reason": "shoulder/hip turn is derived from a 2D projected width (arccos of shoulder width over this clip's widest), which is sign-unstable through square and under-reads true turn by roughly half \u2014 it cannot be scored against criteria.md's anatomical degree bands. Needs a real turn estimate first; see scoring_config/COVERAGE.md.",
          "unit": "deg (2D-projected estimate)",
          "value": null,
          "weight": 72
        },
        {
          "abs_value": false,
          "advice": "Hold more flex in your trail knee at the top \u2014 it's straightening out too much during the backswing.",
          "band": {
            "falloff": 15,
            "max": 35,
            "min": 10
          },
          "category": "backswing_top",
          "checkpoint": "P4",
          "deferred": false,
          "effort": 2,
          "field": "trail_knee_flex",
          "fix": "Feel the trail knee flex held, not straightened.",
          "good_values": null,
          "id": "LOW-01",
          "kind": "band",
          "label": "Trail knee flex retained at top (vs address)",
          "leverage": 53.8,
          "leverage_breakdown": {
            "ease": 80,
            "impact": 50.0,
            "severity": 31.3
          },
          "score": 68.7,
          "skip_reason": null,
          "unit": "deg",
          "value": 5.3,
          "weight": 50
        }
      ],
      "n_deferred": 3,
      "n_measurable": 5,
      "n_total": 5,
      "score": 56.5
    },
    "downswing_plane": {
      "category": "downswing_plane",
      "checks": [
        {
          "abs_value": false,
          "advice": "Hold your wrist angle longer coming down \u2014 you're releasing (casting) the club too early, which costs speed.",
          "band": {
            "falloff": 25,
            "max": 100,
            "min": 60
          },
          "category": "downswing_plane",
          "checkpoint": "P5",
          "deferred": false,
          "effort": 5,
          "field": "lead_wrist_hinge",
          "fix": "Pump drill, pressure-handle drill \u2014 retain the angle deep into the downswing.",
          "good_values": null,
          "id": "DSW-01",
          "kind": "band",
          "label": "Lag / wrist angle retention (mid-downswing)",
          "leverage": 58.6,
          "leverage_breakdown": {
            "ease": 20,
            "impact": 75.0,
            "severity": 80.8
          },
          "score": 19.2,
          "skip_reason": null,
          "unit": "deg",
          "value": 39.8,
          "weight": 75
        },
        {
          "abs_value": false,
          "advice": null,
          "band": {
            "falloff": 20,
            "max": 55,
            "min": 25
          },
          "category": "downswing_plane",
          "checkpoint": "P7",
          "deferred": true,
          "effort": 4,
          "field": "hip_turn_from_address",
          "fix": "Wall drill \u2014 let the pelvis clear.",
          "good_values": null,
          "id": "DSW-03",
          "kind": "band",
          "label": "Hip clearing / rotation near impact",
          "leverage": null,
          "leverage_breakdown": null,
          "score": null,